{
    "$schema": "http://json-schema.org/draft-04/schema#",
    "properties": {
        "filename_icon": {
            "maxLength": 20,
            "minLength": 3,
            "type": [
                "string"
            ]
        },
        "image": {
            "type": [
                "null"
            ]
        },
        "internal_id": {
            "maxLength": 1114,
            "minLength": 19,
            "type": [
                "number"
            ]
        },
        "name": {
            "maxLength": 18,
            "minLength": 3,
            "type": [
                "string"
            ]
        },
        "unique_entry_id": {
            "maxLength": 17,
            "minLength": 17,
            "type": [
                "string"
            ]
        },
        "version_added": {
            "maxLength": 5,
            "minLength": 5,
            "type": [
                "string"
            ]
        }
    },
    "required": [
        "filename_icon",
        "image",
        "internal_id",
        "name",
        "unique_entry_id",
        "version_added"
    ],
    "title": "Reaction",
    "type": "object"
}
